{
  "schema": "shared-closure-manifest/v1",
  "group_id": "agent-workflows.group.F",
  "source": {"path": "agent-workflows/src/ai_agent_workflow/closure_protocol.py", "version": "v1"},
  "selectors": [
    "group.F.F1",
    "group.F.F2",
    "group.F.F3",
    "group.F.F4",
    "group.F.F5",
    "group.F.F6",
    "group.F.F7",
    "group.F.F8"
  ]
}
